<?xml version="1.0" encoding="UTF-8"?>
<!--DTD generated by XMLSpy v2005 rel. 3 U (http://www.altova.com)-->
<!ELEMENT emotion EMPTY>
<!ATTLIST emotion
	name CDATA #REQUIRED
	activation CDATA #REQUIRED
	evaluation CDATA #REQUIRED
	power CDATA #REQUIRED
>
<!ELEMENT emotions (emotion+)>
